-- ==================================================================
-- Test DISTRIBUTED COORDINATOR ONLY tables
-- ==================================================================
-- ==================================================================
-- 0. Test Setup (auxiliary tables)
-- ==================================================================
-- Helper distributed table used by joins and CTAS tests
CREATE TABLE IF NOT EXISTS distributed_table_aux (
    c1 INT,
    c2 INT
) DISTRIBUTED BY (c1);
INSERT INTO distributed_table_aux
SELECT i, 18 + (i % 50)
FROM generate_series(1, 20) i;
CREATE TABLE distributed_table_aux_r AS
SELECT * FROM distributed_table_aux
DISTRIBUTED REPLICATED;
-- ==================================================================
-- 1. Basic Table Creation and Metadata
-- ==================================================================
-- Create a basic coordinator-only table
CREATE TABLE coordinator_only_heap (c1 INT, c2 TEXT, c3 NUMERIC) DISTRIBUTED COORDINATOR ONLY;
\d+ coordinator_only_heap
                           Table "public.coordinator_only_heap"
 Column |  Type   | Collation | Nullable | Default | Storage  | Stats target | Description 
--------+---------+-----------+----------+---------+----------+--------------+-------------
 c1     | integer |           |          |         | plain    |              | 
 c2     | text    |           |          |         | extended |              | 
 c3     | numeric |           |          |         | main     |              | 
Distributed by: DISTRIBUTED COORDINATOR ONLY

-- Verify the distribution policy in catalog
SELECT policytype, numsegments, distkey, distclass
FROM gp_distribution_policy
WHERE localoid = 'coordinator_only_heap'::regclass;
 policytype | numsegments | distkey | distclass 
------------+-------------+---------+-----------
 e          |          -1 |         | 
(1 row)

-- Create coordinator-only table with different storage types
CREATE TABLE coordinator_only_ao (c1 INT, c2 VARCHAR(50))
    USING ao_row
    DISTRIBUTED COORDINATOR ONLY;
\d+ coordinator_only_ao
                                   Table "public.coordinator_only_ao"
 Column |         Type          | Collation | Nullable | Default | Storage  | Stats target | Description 
--------+-----------------------+-----------+----------+---------+----------+--------------+-------------
 c1     | integer               |           |          |         | plain    |              | 
 c2     | character varying(50) |           |          |         | extended |              | 
Distributed by: DISTRIBUTED COORDINATOR ONLY
Options: blocksize=32768, compresslevel=0, compresstype=none, checksum=true

SELECT policytype, numsegments, distkey, distclass
FROM gp_distribution_policy
WHERE localoid = 'coordinator_only_ao'::regclass;
 policytype | numsegments | distkey | distclass 
------------+-------------+---------+-----------
 e          |          -1 |         | 
(1 row)

CREATE TABLE coordinator_only_aoco (c1 BIGINT, c2 FLOAT, c3 DATE)
    USING ao_column
    DISTRIBUTED COORDINATOR ONLY;
\d+ coordinator_only_aoco
                                                         Table "public.coordinator_only_aoco"
 Column |       Type       | Collation | Nullable | Default | Storage | Stats target | Compression Type | Compression Level | Block Size | Description 
--------+------------------+-----------+----------+---------+---------+--------------+------------------+-------------------+------------+-------------
 c1     | bigint           |           |          |         | plain   |              | none             | 0                 | 32768      | 
 c2     | double precision |           |          |         | plain   |              | none             | 0                 | 32768      | 
 c3     | date             |           |          |         | plain   |              | none             | 0                 | 32768      | 
Distributed by: DISTRIBUTED COORDINATOR ONLY
Options: blocksize=32768, compresslevel=0, compresstype=none, checksum=true

SELECT policytype, numsegments, distkey, distclass
FROM gp_distribution_policy
WHERE localoid = 'coordinator_only_aoco'::regclass;
 policytype | numsegments | distkey | distclass 
------------+-------------+---------+-----------
 e          |          -1 |         | 
(1 row)

-- Test data operations on AO table
INSERT INTO coordinator_only_ao VALUES (1001, 'ao_test_1'), (1002, 'ao_test_2');
INSERT INTO coordinator_only_ao SELECT i, 'ao_row_' || i FROM generate_series(1003, 1008) i;
SELECT gp_segment_id, * FROM coordinator_only_ao ORDER BY c1;
 gp_segment_id |  c1  |     c2      
---------------+------+-------------
            -1 | 1001 | ao_test_1
            -1 | 1002 | ao_test_2
            -1 | 1003 | ao_row_1003
            -1 | 1004 | ao_row_1004
            -1 | 1005 | ao_row_1005
            -1 | 1006 | ao_row_1006
            -1 | 1007 | ao_row_1007
            -1 | 1008 | ao_row_1008
(8 rows)

-- Test data operations on AOCO table
INSERT INTO coordinator_only_aoco VALUES (2001, 12.34, '2025-01-15'), (2002, 56.78, '2025-02-20');
INSERT INTO coordinator_only_aoco
SELECT i, i * 3.14, ('2025-01-01'::date + (i - 2000) * interval '1 day')::date
FROM generate_series(2003, 2012) i;
SELECT gp_segment_id, * FROM coordinator_only_aoco ORDER BY c1;
 gp_segment_id |  c1  |   c2    |     c3     
---------------+------+---------+------------
            -1 | 2001 |   12.34 | 01-15-2025
            -1 | 2002 |   56.78 | 02-20-2025
            -1 | 2003 | 6289.42 | 01-04-2025
            -1 | 2004 | 6292.56 | 01-05-2025
            -1 | 2005 |  6295.7 | 01-06-2025
            -1 | 2006 | 6298.84 | 01-07-2025
            -1 | 2007 | 6301.98 | 01-08-2025
            -1 | 2008 | 6305.12 | 01-09-2025
            -1 | 2009 | 6308.26 | 01-10-2025
            -1 | 2010 |  6311.4 | 01-11-2025
            -1 | 2011 | 6314.54 | 01-12-2025
            -1 | 2012 | 6317.68 | 01-13-2025
(12 rows)

-- VACUUM and ANALYZE on AO tables
VACUUM coordinator_only_ao;
ANALYZE coordinator_only_ao;
SELECT tablename, attname FROM pg_stats WHERE tablename = 'coordinator_only_ao' ORDER BY attname;
      tablename      | attname 
---------------------+---------
 coordinator_only_ao | c1
 coordinator_only_ao | c2
(2 rows)

VACUUM coordinator_only_aoco;
ANALYZE coordinator_only_aoco;
SELECT tablename, attname FROM pg_stats WHERE tablename = 'coordinator_only_aoco' ORDER BY attname;
       tablename       | attname 
-----------------------+---------
 coordinator_only_aoco | c1
 coordinator_only_aoco | c2
 coordinator_only_aoco | c3
(3 rows)

-- ==================================================================
-- 2. Data Insertion and Verification
-- ==================================================================
-- INSERT with VALUES
INSERT INTO coordinator_only_heap VALUES (100, 'alpha', 10.5), (200, 'beta', 20.7);
-- INSERT with SELECT
INSERT INTO coordinator_only_heap
SELECT i, 'data_' || i, i * 1.5
FROM generate_series(300, 315) i;
-- Verify all data is on coordinator (gp_segment_id = -1)
SELECT gp_segment_id, count(*) FROM coordinator_only_heap GROUP BY gp_segment_id ORDER BY gp_segment_id;
 gp_segment_id | count 
---------------+-------
            -1 |    18
(1 row)

SELECT gp_segment_id, count(*) FROM gp_dist_random('coordinator_only_heap') GROUP BY gp_segment_id ORDER BY gp_segment_id;
 gp_segment_id | count 
---------------+-------
(0 rows)

SELECT gp_segment_id, count(*) FROM coordinator_only_ao GROUP BY gp_segment_id ORDER BY gp_segment_id;
 gp_segment_id | count 
---------------+-------
            -1 |     8
(1 row)

SELECT gp_segment_id, count(*) FROM gp_dist_random('coordinator_only_ao') GROUP BY gp_segment_id ORDER BY gp_segment_id;
 gp_segment_id | count 
---------------+-------
(0 rows)

SELECT gp_segment_id, count(*) FROM coordinator_only_aoco GROUP BY gp_segment_id ORDER BY gp_segment_id;
 gp_segment_id | count 
---------------+-------
            -1 |    12
(1 row)

SELECT gp_segment_id, count(*) FROM gp_dist_random('coordinator_only_aoco') GROUP BY gp_segment_id ORDER BY gp_segment_id;
 gp_segment_id | count 
---------------+-------
(0 rows)

-- Verify physical storage location
SELECT pg_relation_size('coordinator_only_heap') > 0 AS has_data_on_coordinator;
 has_data_on_coordinator 
-------------------------
 t
(1 row)

-- ==================================================================
-- 3. COPY Operations
-- ==================================================================
-- COPY FROM stdin
COPY coordinator_only_heap FROM stdin WITH delimiter ',';
-- COPY TO stdout
COPY coordinator_only_heap TO stdout;
100	alpha	10.5
200	beta	20.7
300	data_300	450.0
301	data_301	451.5
302	data_302	453.0
303	data_303	454.5
304	data_304	456.0
305	data_305	457.5
306	data_306	459.0
307	data_307	460.5
308	data_308	462.0
309	data_309	463.5
310	data_310	465.0
311	data_311	466.5
312	data_312	468.0
313	data_313	469.5
314	data_314	471.0
315	data_315	472.5
400	gamma	33.3
500	delta	44.4
600	epsilon	55.5
-- COPY with ON SEGMENT (should work for now)
COPY coordinator_only_heap(c1) FROM PROGRAM 'seq <SEGID> 7' ON SEGMENT;
-- ==================================================================
-- 4. Table Maintenance Operations
-- ==================================================================
-- ANALYZE
ANALYZE coordinator_only_heap;
SELECT tablename, attname, n_distinct
FROM pg_stats
WHERE tablename = 'coordinator_only_heap'
ORDER BY attname;
       tablename       | attname | n_distinct 
-----------------------+---------+------------
 coordinator_only_heap | c1      |         -1
 coordinator_only_heap | c2      |         -1
 coordinator_only_heap | c3      |         -1
(3 rows)

-- VACUUM
VACUUM coordinator_only_heap;
-- DELETE
DELETE FROM coordinator_only_heap WHERE c1 < 200;
SELECT COUNT(*) FROM coordinator_only_heap;
 count 
-------
    20
(1 row)

-- UPDATE
UPDATE coordinator_only_heap SET c3 = c3 * 2 WHERE c1 > 300;
SELECT * FROM coordinator_only_heap ORDER BY c1 LIMIT 8;
 c1  |    c2    |  c3   
-----+----------+-------
 200 | beta     |  20.7
 300 | data_300 | 450.0
 301 | data_301 | 903.0
 302 | data_302 | 906.0
 303 | data_303 | 909.0
 304 | data_304 | 912.0
 305 | data_305 | 915.0
 306 | data_306 | 918.0
(8 rows)

-- TRUNCATE
TRUNCATE TABLE coordinator_only_heap;
SELECT COUNT(*) FROM coordinator_only_heap;
 count 
-------
     0
(1 row)

-- ==================================================================
-- 5. Index Operations
-- ==================================================================
-- Repopulate for index tests
INSERT INTO coordinator_only_heap
SELECT i, 'row_' || i, i * 0.75
FROM generate_series(1, 800) i;
-- Create various index types
CREATE UNIQUE INDEX idx_coordinator_only_unique ON coordinator_only_heap(c1);
CREATE INDEX idx_coordinator_only_btree ON coordinator_only_heap(c2);
-- Verify index usage
EXPLAIN SELECT * FROM coordinator_only_heap WHERE c1 = 42;
                                                QUERY PLAN                                                
----------------------------------------------------------------------------------------------------------
 Index Scan using idx_coordinator_only_unique on coordinator_only_heap  (cost=0.16..8.18 rows=1 width=18)
   Index Cond: (c1 = 42)
 Optimizer: Postgres-based planner
(3 rows)

SELECT * FROM coordinator_only_heap WHERE c1 = 42;
 c1 |   c2   |  c3   
----+--------+-------
 42 | row_42 | 31.50
(1 row)

EXPLAIN SELECT * FROM coordinator_only_heap WHERE c2 = 'row_123';
                                               QUERY PLAN                                                
---------------------------------------------------------------------------------------------------------
 Index Scan using idx_coordinator_only_btree on coordinator_only_heap  (cost=0.16..8.18 rows=1 width=18)
   Index Cond: (c2 = 'row_123'::text)
 Optimizer: Postgres-based planner
(3 rows)

SELECT * FROM coordinator_only_heap WHERE c2 = 'row_123';
 c1  |   c2    |  c3   
-----+---------+-------
 123 | row_123 | 92.25
(1 row)

-- ==================================================================
-- 6. CREATE TABLE AS SELECT (CTAS)
-- ==================================================================
-- CTAS from a regular distributed table to distributed
CREATE TABLE ctas_from_distributed_to_distributed AS
SELECT * FROM distributed_table_aux
WHERE c2 > 25
DISTRIBUTED BY (c1);
\d+ ctas_from_distributed_to_distributed
                   Table "public.ctas_from_distributed_to_distributed"
 Column |  Type   | Collation | Nullable | Default | Storage | Stats target | Description 
--------+---------+-----------+----------+---------+---------+--------------+-------------
 c1     | integer |           |          |         | plain   |              | 
 c2     | integer |           |          |         | plain   |              | 
Distributed by: (c1)

-- CTAS from a regular distributed table to coordinator-only, should fail
CREATE TABLE ctas_from_distributed AS
SELECT * FROM distributed_table_aux
WHERE c2 > 25
DISTRIBUTED COORDINATOR ONLY;
ERROR:  CTAS DISTRIBUTED COORDINATOR ONLY is not supported yet
-- CTAS from a coordinator-only table to coordinator-only, should fail
CREATE TABLE ctas_from_coordinator_only_to_only AS
SELECT * FROM coordinator_only_heap
WHERE c1 > 25
DISTRIBUTED COORDINATOR ONLY;
ERROR:  CTAS DISTRIBUTED COORDINATOR ONLY is not supported yet
-- CTAS from coordinator-only table (should create hash-distributed table by default)
CREATE TABLE ctas_from_coordinator_only_no_distribution AS
SELECT * FROM coordinator_only_heap
WHERE c1 BETWEEN 50 AND 150;
NOTICE:  Table doesn't have 'DISTRIBUTED BY' clause -- Using column(s) named 'c1' as the Greenplum Database data distribution key for this table.
HINT:  The 'DISTRIBUTED BY' clause determines the distribution of data. Make sure column(s) chosen are the optimal data distribution key to minimize skew.
\d+ ctas_from_coordinator_only_no_distribution
                 Table "public.ctas_from_coordinator_only_no_distribution"
 Column |  Type   | Collation | Nullable | Default | Storage  | Stats target | Description 
--------+---------+-----------+----------+---------+----------+--------------+-------------
 c1     | integer |           |          |         | plain    |              | 
 c2     | text    |           |          |         | extended |              | 
 c3     | numeric |           |          |         | main     |              | 
Distributed by: (c1)

-- ==================================================================
-- 7. CREATE TABLE LIKE
-- ==================================================================
-- LIKE should inherit DISTRIBUTED COORDINATOR ONLY
CREATE TABLE like_coordinator_only (LIKE coordinator_only_heap);
NOTICE:  table doesn't have 'DISTRIBUTED BY' clause, defaulting to distribution columns from LIKE table
\d+ like_coordinator_only
                           Table "public.like_coordinator_only"
 Column |  Type   | Collation | Nullable | Default | Storage  | Stats target | Description 
--------+---------+-----------+----------+---------+----------+--------------+-------------
 c1     | integer |           |          |         | plain    |              | 
 c2     | text    |           |          |         | extended |              | 
 c3     | numeric |           |          |         | main     |              | 
Distributed by: DISTRIBUTED COORDINATOR ONLY

-- ==================================================================
-- 8. Query Planning and Execution
-- ==================================================================
-- Simple scan should execute only on coordinator
EXPLAIN SELECT * FROM coordinator_only_heap;
                                QUERY PLAN                                
--------------------------------------------------------------------------
 Seq Scan on coordinator_only_heap  (cost=0.00..81.10 rows=7110 width=18)
 Optimizer: Postgres-based planner
(2 rows)

-- Join with distributed table (should broadcast coordinator-only table)
EXPLAIN SELECT * FROM coordinator_only_heap c, distributed_table_aux d
WHERE c.c1 = d.c2;
                                             QUERY PLAN                                             
----------------------------------------------------------------------------------------------------
 Gather Motion 3:1  (slice1; segments: 3)  (cost=205.53..2610.87 rows=86100 width=26)
   ->  Hash Join  (cost=205.53..1462.87 rows=28700 width=26)
         Hash Cond: (d.c2 = c.c1)
         ->  Redistribute Motion 3:3  (slice2; segments: 3)  (cost=0.00..895.00 rows=28700 width=8)
               Hash Key: d.c2
               ->  Seq Scan on distributed_table_aux d  (cost=0.00..321.00 rows=28700 width=8)
         ->  Hash  (cost=175.90..175.90 rows=2370 width=18)
               ->  Redistribute Motion 1:3  (slice3)  (cost=0.00..175.90 rows=2370 width=18)
                     Hash Key: c.c1
                     ->  Seq Scan on coordinator_only_heap c  (cost=0.00..81.10 rows=7110 width=18)
 Optimizer: Postgres-based planner
(11 rows)

-- Aggregation on coordinator-only table
EXPLAIN SELECT COUNT(*), AVG(c1), MAX(c3) FROM coordinator_only_heap;
                                   QUERY PLAN                                   
--------------------------------------------------------------------------------
 Aggregate  (cost=134.43..134.44 rows=1 width=72)
   ->  Seq Scan on coordinator_only_heap  (cost=0.00..81.10 rows=7110 width=10)
 Optimizer: Postgres-based planner
(3 rows)

SELECT COUNT(*), AVG(c1)::NUMERIC(10,2), MAX(c3) FROM coordinator_only_heap;
 count |  avg   |  max   
-------+--------+--------
   800 | 400.50 | 600.00
(1 row)

-- Subquery
EXPLAIN SELECT * FROM distributed_table_aux
WHERE c2 IN (SELECT c1 FROM coordinator_only_heap WHERE c1 < 500);
                                           QUERY PLAN                                            
-------------------------------------------------------------------------------------------------
 Gather Motion 3:1  (slice1; segments: 3)  (cost=318.36..1190.58 rows=27261 width=8)
   ->  Hash Join  (cost=318.36..827.10 rows=9087 width=8)
         Hash Cond: (distributed_table_aux.c2 = coordinator_only_heap.c1)
         ->  Seq Scan on distributed_table_aux  (cost=0.00..392.75 rows=9567 width=8)
               Filter: (c2 < 500)
         ->  Hash  (cost=233.94..233.94 rows=6753 width=4)
               ->  Broadcast Motion 1:3  (slice2)  (cost=0.00..233.94 rows=6753 width=4)
                     ->  Seq Scan on coordinator_only_heap  (cost=0.00..98.88 rows=6753 width=4)
                           Filter: (c1 < 500)
 Optimizer: Postgres-based planner
(10 rows)

-- ==================================================================
-- 9. Materialized Views
-- ==================================================================
-- Create matview with explicit DISTRIBUTED COORDINATOR ONLY, should fail
CREATE MATERIALIZED VIEW mv_coordinator_only_explicit AS
SELECT i FROM generate_series(1, 20) i
DISTRIBUTED COORDINATOR ONLY;
ERROR:  CTAS DISTRIBUTED COORDINATOR ONLY is not supported yet
-- Matview from coordinator-only table (should infer hash distribution)
CREATE MATERIALIZED VIEW mv_from_coordinator_only AS
SELECT c1, c2 FROM coordinator_only_heap WHERE c1 BETWEEN 100 AND 200;
NOTICE:  Table doesn't have 'DISTRIBUTED BY' clause -- Using column(s) named 'c1' as the Greenplum Database data distribution key for this table.
HINT:  The 'DISTRIBUTED BY' clause determines the distribution of data. Make sure column(s) chosen are the optimal data distribution key to minimize skew.
\d+ mv_from_coordinator_only;
                    Materialized view "public.mv_from_coordinator_only"
 Column |  Type   | Collation | Nullable | Default | Storage  | Stats target | Description 
--------+---------+-----------+----------+---------+----------+--------------+-------------
 c1     | integer |           |          |         | plain    |              | 
 c2     | text    |           |          |         | extended |              | 
View definition:
 SELECT coordinator_only_heap.c1,
    coordinator_only_heap.c2
   FROM coordinator_only_heap
  WHERE coordinator_only_heap.c1 >= 100 AND coordinator_only_heap.c1 <= 200;
Distributed by: (c1)

-- ==================================================================
-- 10. Constraints
-- ==================================================================
-- Create table with constraints
CREATE TABLE coordinator_only_constraints (
    c1 SERIAL PRIMARY KEY,
    c2 VARCHAR(80) NOT NULL,
    c3 INT CHECK (c3 BETWEEN 1 AND 999),
    UNIQUE(c2)
) DISTRIBUTED COORDINATOR ONLY;
INSERT INTO coordinator_only_constraints (c2, c3) VALUES ('item_a', 50);
INSERT INTO coordinator_only_constraints (c2, c3) VALUES ('item_b', 150);
INSERT INTO coordinator_only_constraints (c2, c3) VALUES ('item_c', 250);
-- Should fail - duplicate c2
INSERT INTO coordinator_only_constraints (c2, c3) VALUES ('item_a', 75);
ERROR:  duplicate key value violates unique constraint "coordinator_only_constraints_c2_key"
DETAIL:  Key (c2)=(item_a) already exists.
-- Should fail - check constraint violation
INSERT INTO coordinator_only_constraints (c2, c3) VALUES ('item_d', 1000);
ERROR:  new row for relation "coordinator_only_constraints" violates check constraint "coordinator_only_constraints_c3_check"
DETAIL:  Failing row contains (5, item_d, 1000).
-- ==================================================================
-- 11. Error Cases - Operations Not Supported
-- ==================================================================
-- Cannot use COPY with error logging on coordinator-only tables
COPY coordinator_only_heap FROM PROGRAM 'seq 1 25'
LOG ERRORS SEGMENT REJECT LIMIT 5;
ERROR:  COPY single row error handling only available for distributed user tables
-- Cannot ALTER distribution policy
ALTER TABLE coordinator_only_heap SET DISTRIBUTED RANDOMLY;
ERROR:  cannot set the policy of a non-distributed table
-- Cannot change existing replicated table to coordinator-only
ALTER TABLE distributed_table_aux_r SET DISTRIBUTED COORDINATOR ONLY;
ERROR:  cannot SET DISTRIBUTED COORDINATOR ONLY
-- Cannot EXPAND coordinator-only tables
ALTER TABLE coordinator_only_heap EXPAND TABLE;
ERROR:  cannot expand a non-distributed table
-- ==================================================================
-- 12. Error Cases - External Tables
-- ==================================================================
-- Readable external tables cannot specify DISTRIBUTED clause
CREATE EXTERNAL WEB TABLE ext_readable_coordinator_only(x TEXT)
EXECUTE e'echo 1' FORMAT 'text'
DISTRIBUTED COORDINATOR ONLY;
ERROR:  readable external tables can't specify a DISTRIBUTED BY clause
-- Writable external tables cannot use DISTRIBUTED COORDINATOR ONLY
CREATE WRITABLE EXTERNAL WEB TABLE ext_writable_coordinator_only(x TEXT)
EXECUTE 'cat > /dev/null' FORMAT 'text'
DISTRIBUTED COORDINATOR ONLY;
ERROR:  external tables can't have DISTRIBUTED COORDINATOR ONLY clause
-- ==================================================================
-- 13. Error Cases - Inheritance
-- ==================================================================
-- Cannot inherit from coordinator-only table
CREATE TABLE inherit_from_coordinator_only(k INT)
INHERITS (coordinator_only_heap);
ERROR:  cannot inherit from non-distributed table "coordinator_only_heap" to create table "inherit_from_coordinator_only"
DETAIL:  An inheritance hierarchy cannot contain a mixture of distributed and non-distributed tables.
-- ==================================================================
-- 14. Error Cases - Functions on Segments
-- ==================================================================
-- Functions accessing coordinator-only tables should error on segments
CREATE OR REPLACE FUNCTION get_coordinator_only_data()
RETURNS SETOF coordinator_only_heap AS $$
BEGIN
    RETURN QUERY SELECT * FROM coordinator_only_heap;
END;
$$ LANGUAGE plpgsql EXECUTE ON ALL SEGMENTS;
SELECT * FROM get_coordinator_only_data();
ERROR:  function cannot execute on a QE slice because it accesses relation "public.coordinator_only_heap"  (seg0 slice1 127.0.0.1:40000 pid=594243)
CONTEXT:  SQL statement "SELECT * FROM coordinator_only_heap"
PL/pgSQL function get_coordinator_only_data() line 3 at RETURN QUERY
-- Functions accessing coordinator-only tables should work on the coordinator
CREATE OR REPLACE FUNCTION get_coordinator_only_data_on_coordinator()
RETURNS SETOF coordinator_only_heap AS $$
BEGIN
    RETURN QUERY SELECT * FROM coordinator_only_heap;
END;
$$ LANGUAGE plpgsql EXECUTE ON COORDINATOR;
SELECT count(*) FROM get_coordinator_only_data_on_coordinator();
 count 
-------
   800
(1 row)

-- ==================================================================
-- 15. Partitioned Tables (should not be allowed)
-- ==================================================================
-- Coordinator-only tables cannot be partitioned
CREATE TABLE coordinator_only_partitioned (
    c1 INT,
    c2 DATE
) DISTRIBUTED COORDINATOR ONLY
PARTITION BY RANGE (c2)
(
    START ('2025-01-01'::DATE) END ('2025-12-31'::DATE) EVERY (INTERVAL '3 months')
);
ERROR:  PARTITION BY clause cannot be used with DISTRIBUTED REPLICATED or COORDINATOR ONLY clause
-- ==================================================================
-- 16. Cleanup
-- ==================================================================
-- Before cleanup: verify coordinator-only tables exist in segments catalog
SELECT gp_segment_id, count(*)
FROM gp_dist_random('pg_class')
WHERE relname IN ('coordinator_only_heap', 'coordinator_only_ao', 'coordinator_only_aoco',
                  'like_coordinator_only', 'coordinator_only_constraints')
GROUP BY gp_segment_id
ORDER BY gp_segment_id;
 gp_segment_id | count 
---------------+-------
             0 |     5
             1 |     5
             2 |     5
(3 rows)

-- Left two coordinator-only tables for following pg_upgrade and gpcheckcat tests
--  DROP TABLE IF EXISTS coordinator_only_heap CASCADE;
DROP TABLE IF EXISTS coordinator_only_ao CASCADE;
--  DROP TABLE IF EXISTS coordinator_only_aoco CASCADE;
DROP TABLE IF EXISTS like_coordinator_only CASCADE;
DROP TABLE IF EXISTS coordinator_only_constraints CASCADE;
DROP FUNCTION IF EXISTS get_coordinator_only_data() CASCADE;
DROP FUNCTION IF EXISTS get_coordinator_only_data_on_coordinator() CASCADE;
-- Extra cleanup for auxiliary and optional objects
DROP TABLE IF EXISTS distributed_table_aux CASCADE;
DROP TABLE IF EXISTS distributed_table_aux_r CASCADE;
-- After cleanup: verify coordinator-only tables no longer exist in segments catalog
SELECT gp_segment_id, count(*)
FROM gp_dist_random('pg_class')
WHERE relname IN ('coordinator_only_heap', 'coordinator_only_ao', 'coordinator_only_aoco',
                  'like_coordinator_only', 'coordinator_only_constraints')
GROUP BY gp_segment_id
ORDER BY gp_segment_id;
 gp_segment_id | count 
---------------+-------
             0 |     2
             1 |     2
             2 |     2
(3 rows)

